{"$schema":"https://json-schema.org/draft/2020-12/schema","additionalProperties":false,"allOf":[{"if":{"properties":{"disposition":{"const":"completed"}}},"then":{"properties":{"cleanup":{"const":"complete"},"executionStarted":{"const":true},"handoff":{"const":"complete"},"outputComplete":{"const":true},"outputs":{"minItems":1},"retirement":{"properties":{"containers":{"const":"retired"},"helpers":{"const":"retired"}}},"steps":{"minItems":1}}}}],"properties":{"cleanup":{"enum":["complete","pending","unknown"]},"disposition":{"enum":["completed","refused","failed","unknown"]},"elapsed":{"oneOf":[{"additionalProperties":false,"properties":{"milliseconds":{"maximum":9223372036854775807,"minimum":0,"type":"integer"},"state":{"const":"known"}},"required":["state","milliseconds"],"type":"object"},{"additionalProperties":false,"properties":{"reason":{"pattern":"^[a-zA-Z0-9._:/-]{1,128}$","type":"string"},"state":{"const":"unknown"}},"required":["state","reason"],"type":"object"}]},"executionStarted":{"type":"boolean"},"handoff":{"enum":["absent","complete","unknown"]},"operationId":{"format":"uuid","type":"string"},"outputComplete":{"type":"boolean"},"outputs":{"items":{"additionalProperties":false,"properties":{"bytes":{"maximum":16777216,"minimum":0,"type":"integer"},"relativePath":{"maxLength":4096,"minLength":1,"type":"string"},"sha256":{"pattern":"^[0-9a-f]{64}$","type":"string"}},"required":["relativePath","bytes","sha256"],"type":"object"},"maxItems":1024,"type":"array"},"profileSha256":{"pattern":"^[0-9a-f]{64}$","type":"string"},"reason":{"pattern":"^[a-zA-Z0-9._:/-]{1,128}$","type":"string"},"requestSha256":{"pattern":"^[0-9a-f]{64}$","type":"string"},"retirement":{"additionalProperties":false,"properties":{"containers":{"enum":["not-started","retired","unknown"]},"helpers":{"enum":["not-started","retired","unknown"]}},"required":["containers","helpers"],"type":"object"},"schema":{"const":"fsgg.portable-workspace-c2-phase-result/1"},"stderrBase64":{"maxLength":1398104,"type":"string"},"stdoutBase64":{"maxLength":1398104,"type":"string"},"steps":{"items":{"additionalProperties":false,"properties":{"duration":{"oneOf":[{"additionalProperties":false,"properties":{"milliseconds":{"maximum":9223372036854775807,"minimum":0,"type":"integer"},"state":{"const":"known"}},"required":["state","milliseconds"],"type":"object"},{"additionalProperties":false,"properties":{"reason":{"pattern":"^[a-zA-Z0-9._:/-]{1,128}$","type":"string"},"state":{"const":"unknown"}},"required":["state","reason"],"type":"object"}]},"exit":{"oneOf":[{"additionalProperties":false,"properties":{"code":{"maximum":2147483647,"minimum":-2147483648,"type":"integer"},"state":{"const":"known"}},"required":["state","code"],"type":"object"},{"additionalProperties":false,"properties":{"reason":{"pattern":"^[a-zA-Z0-9._:/-]{1,128}$","type":"string"},"state":{"const":"unknown"}},"required":["state","reason"],"type":"object"}]},"stepId":{"enum":["template-install","template-create","compiler-build"]}},"required":["stepId","exit","duration"],"type":"object"},"maxItems":2,"type":"array"}},"required":["schema","operationId","requestSha256","profileSha256","disposition","reason","executionStarted","retirement","cleanup","handoff","stdoutBase64","stderrBase64","outputComplete","steps","outputs","elapsed"],"type":"object"}
