{"cleanup":"complete","disposition":"completed","elapsed":{"milliseconds":1000,"state":"known"},"executionStarted":true,"handoff":"complete","operationId":"00000000-0000-4000-8000-000000000001","outputComplete":true,"outputs":[{"bytes":1,"relativePath":"project.txt","sha256":"2d711642b726b04401627ca9fbac32f5c8530fb1903cc4db02258717921a4881"}],"profileSha256":"1b80447df09b6e40a9438bfde95a0e3d7923e9bdbd5be0f045891a24600a0a6e","reason":"declared-completion","requestSha256":"c1a43ff4ff84db0ad587decdaeba437adb22d6b5652448b34f78326465ca4c41","retirement":{"containers":"retired","helpers":"retired"},"schema":"fsgg.portable-workspace-c2-phase-result/1","stderrBase64":"","stdoutBase64":"","steps":[{"duration":{"milliseconds":100,"state":"known"},"exit":{"code":0,"state":"known"},"stepId":"template-install"},{"duration":{"milliseconds":100,"state":"known"},"exit":{"code":0,"state":"known"},"stepId":"template-create"}]}
