{"cleanup":"complete","disposition":"refused","elapsed":{"milliseconds":0,"state":"known"},"executionStarted":false,"handoff":"absent","operationId":"00000000-0000-4000-8000-000000000001","outputComplete":true,"outputs":[],"profileSha256":"1b80447df09b6e40a9438bfde95a0e3d7923e9bdbd5be0f045891a24600a0a6e","reason":"enrollment-unavailable","requestSha256":"c1a43ff4ff84db0ad587decdaeba437adb22d6b5652448b34f78326465ca4c41","retirement":{"containers":"not-started","helpers":"not-started"},"schema":"fsgg.portable-workspace-c2-phase-result/1","stderrBase64":"","stdoutBase64":"","steps":[]}
